"There is a f___ n___ of resources available, so we must use them wisely (a limited or restricted amount)","There is a finite number of resources available, so we must use them wisely"
"The company had an e___ s___ of ideas, thanks to its creative employees (a seemingly infinite or limitless amount)","The company had an endless supply of ideas, thanks to its creative employees"
"The new employee was an u___ q___, as no one knew what skills or abilities he possessed (a person or thing whose characteristics or potential are uncertain or not well known)","The new employee was an unknown quantity, as no one knew what skills or abilities he possessed"
"The new legislation introduced s___ c___ that affected the entire industry (large-scale or far-reaching modifications)","The new legislation introduced sweeping changes that affected the entire industry"
"Having a vacation w___ m___ a c___ from our daily routine (to be a refreshing or welcome difference)","Having a vacation would make a change from our daily routine"
"The market experienced a s___ s___ after the surprising news (an abrupt or unexpected alteration in circumstances)","The market experienced a sudden shift after the surprising news"
"The heavy snowfall forced the city to b___ a h___ t___ traffic (to cause something to stop or cease)","The heavy snowfall forced the city to bring a halt to traffic"
"The authorities had to c___ o___ a s___ for the parade (to prevent access to a particular area)","The authorities had to close off a street for the parade"
"He made a public statement to d___ r___ about the company's financial status (to put an end to false information or speculation)","He made a public statement to dispel rumours about the company's financial status"
"The investigation revealed the r___ c___ of the accident (the primary or underlying reason for something)","The investigation revealed the root cause of the accident"
"The controversial decision p___ a___ o___ from the public (to cause a strong and vocal negative reaction)","The controversial decision provoked an outcry from the public"
"Not following safety protocols could lead to d___ c___ (extremely negative or harmful results)","Not following safety protocols could lead to dire consequences"
"The garden was buzzing with a s___ o___ b___ (a large group of bees moving together)","The garden was buzzing with a swarm of bees"
"The office was filled with a f___ o___ a___ as the deadline approached (a sudden burst of energy, movement, or activity)","The office was filled with a flurry of activity as the deadline approached"
"His innovative solution was a s___ o___ g___ (an exceptionally brilliant idea or act)","His innovative solution was a stroke of genius"
"The two paintings b___ l___ r___ t___ each other (to have very few similarities)","The two paintings bear little resemblance to each other"
"Their political views were p___ o___ (completely different or contrasting perspectives)","Their political views were polar opposites"
"It's interesting to d___ a c___ b___ their leadership styles (to identify similarities or differences between two things)","It's interesting to draw a comparison between their leadership styles"
"I wasn't sure if I could finish the race, but I decided to g___ i___ m___ b___ s___ (to try one's hardest)","I wasn't sure if I could finish the race, but I decided to give it my best shot"
"Despite his a___ a___, he couldn't convince his boss to give him a raise (an unsuccessful or unproductive effort)","Despite his abortive attempt, he couldn't convince his boss to give him a raise"
"Completing the project on time was a h___ s___, but it was worth it (a difficult, exhausting, and time-consuming task)","Completing the project on time was a hard slog, but it was worth it"
"I'm n___ l___ a___ s___ about the upcoming presentation (not to worry or be concerned about something)","I'm not losing any sleep about the upcoming presentation"
"T___ b___ b___ h___, I don't think your idea will work (to be completely honest, even if it may hurt someone's feelings)","To be brutally honest, I don't think your idea will work"
"She's always b___ o___ t___ g___, never taking a break (to be constantly active or busy)","She's always be on the go, never taking a break"
"We need to m___ a c___ to reducing our carbon footprint (to promise or pledge to do something)","We need to make a commitment to reducing our carbon footprint"
"He wouldn't g___ a s___ a___ to my question (to provide a clear, direct, and honest response)","He wouldn't give a straight answer to my question"
"I think you m___ t___ p___ of my argument (to fail to understand the essential or important part of something)","I think you miss the point of my argument"
"Discovering the broken vase was a n___ s___ for her (an unpleasant and unexpected surprise)","Discovering the broken vase was a nasty shock for her"
"He t___ e___ t___ her rude comment (to strongly object or be offended by something)","He took exception to her rude comment"
"The team s___ a___ t___ h___ o___ the biased referee (to experience negative treatment or harm from someone)","The team suffered at the hands of the biased referee"
"Completing the project gave him a s___ o___ a___ (a feeling of accomplishment or pride from doing something)","Completing the project gave him a sense of achievement"
"After winning the lottery, she was in a s___ o___ e___ (a feeling of extreme happiness or excitement)","After winning the lottery, she was in a state of euphoria"
"He d___ p___ f___ helping others in need (to gain enjoyment or satisfaction from something)","He derived pleasure from helping others in need"
"I need to k___ u___ my Thai (to stay informed or maintain pace with something)","I need to keep up my Thai"
"After trying sushi a few times, I eventually a___ a t___ for it (to develop a liking for something after experiencing it several times)","After trying sushi a few times, I eventually acquired a taste for it"
"Her u___ d___ shocked everyone (a death that occurs unexpectedly or earlier than expected)","Her untimely death shocked everyone"
"The bombing caused significant c___ d___ to nearby buildings (unintended damage, injury, or death caused during a military operation)","The bombing caused significant collateral damage to nearby buildings"
"He has e___ c___ in his ability to complete the project on time (to be very confident or certain about something)","He has every confidence in his ability to complete the project on time"
"Extreme sports often c___ a r___ of injury (to involve a possibility of danger or harm)","Extreme sports often carry a risk of injury"
"This room is g___ s___ (a suitable or desirable size)","This room is good size"
"The new employee is an u___ q___ (a person or thing whose qualities, abilities, or potential are unknown)","The new employee is an unknown quantity"
"I want to m___ a c___ in my career and try something new (to alter or adjust something)","I want to make a change in my career and try something new"
"The company took steps to a___ f___ about the new policy (to reduce or relieve someone's worries or concerns)","The company took steps to allay fears about the new policy"
"New technology can r___ o___ older methods (to make something outdated or unnecessary)","New technology can render obsolete older methods"
"Unfair treatment can b___ r___ among employees (to cause feelings of anger, bitterness, or envy)","Unfair treatment can breed resentment among employees"
"The hurricane could s___ d___ for the coastal town (to lead to a very bad or destructive situation)","The hurricane could spell disaster for the coastal town"
"There's a y___ g___ between the rich and the poor (a large difference or disparity)","There's a yawning gap between the rich and the poor"
"Her performance can b___ c___ w___ the best in the industry (to be worthy of comparison)","Her performance can bear comparison with the best in the industry"
"The two paintings b___ r___ t___ each other (to be similar or alike in appearance)","The two paintings bear resemblance to each other"
"Getting the project approved was an u___ s___ (a difficult and demanding task)","Getting the project approved was an uphill struggle"
"He o___ a___ e___ for his unusual decision (to provide a reason or justification for something)","He offered an explanation for his unusual decision"
"The politician had to f___ a q___ about his recent actions (to respond to or answer a question, especially in a challenging situation)","The politician had to field a question about his recent actions"
"His decision was a l___ o___ j___ (a poor or mistaken choice made due to poor reasoning or carelessness)","His decision was a lapse of judgement"
"She made d___ r___ about her coworker's abilities (critical or belittling comments)","She made disparaging remarks about her coworker's abilities"
"His suggestion was a l___ i___ (an idea that seems foolish, ridiculous, or absurd)","His suggestion was a laughable idea"
"Her latest idea was so h___, it would never work (foolish or ill-conceived)","Her latest idea was so harebrained, it would never work"
"During the debate, he managed t___ t___ a___ s___ a___ his opponent without anyone noticing (to make a critical or negative remark about someone indirectly)","During the debate, he managed to take a sideswipe at his opponent without anyone noticing"
"Mike t___ e___ t___ Sarah's comment, thinking it was offensive (to object or disagree with something)","Mike took exception to Sarah's comment, thinking it was offensive"
"Relaxing on the beach, she felt s____ b___ envelop her (complete happiness or pleasure)","Relaxing on the beach, she felt sheer bliss envelop her"